{
  "round_id": "AL-03-tool-probe-ci",
  "timestamp": "2026-06-09T14:05:00+00:00",
  "agent": "Cursor Composer",
  "agent_surface": "cursor",
  "mode": "implement",
  "goal": "AL-03：将 tool_probe 纳入 CI/pre-commit，更新 TOOL_INVENTORY 说明",
  "scope": [
    "scripts/tool_probe.py",
    ".github/workflows/tool-probe.yml",
    ".pre-commit-config.yaml",
    "package.json",
    "docs/TOOL_INVENTORY.md"
  ],
  "repo_status_before": "agent-layer-2.0-bootstrap complete; uncommitted UI work on main",
  "tool_probe_status": "passed",
  "tools_available": [
    "shell",
    "git",
    "node_npm",
    "python",
    "ffmpeg",
    "gh_cli",
    "playwright_mcp",
    "chrome_devtools_mcp",
    "filesystem_mcp",
    "github_mcp",
    "context7_mcp",
    "stitch_mcp"
  ],
  "tools_used": [
    {
      "tool": "shell",
      "purpose": "tool_probe --ci, agent_gate, npm agent:probe:ci",
      "result": "gate passed; CI mode partial (docker/java optional missing)",
      "fallback_used": false
    },
    {
      "tool": "Read/Grep/Glob",
      "purpose": "read AGENTS.md, agent_layer, roadmap AL-03, existing scripts",
      "result": "implemented CI integration",
      "fallback_used": false
    },
    {
      "tool": "playwright_cli",
      "purpose": "agent_gate npm run agent:check (12 E2E tests)",
      "result": "12 passed",
      "fallback_used": false
    }
  ],
  "tools_not_used": [
    {
      "tool": "playwright_mcp",
      "reason": "AL-03 is CI/tooling; gate used Playwright CLI via npm test"
    },
    {
      "tool": "chrome_devtools_mcp",
      "reason": "no UI change this round"
    },
    {
      "tool": "context7_mcp",
      "reason": "no library API uncertainty; pre-commit/GHA patterns are standard"
    },
    {
      "tool": "stitch_mcp",
      "reason": "no UI design round"
    },
    {
      "tool": "github_mcp",
      "reason": "workflow file added locally; no push/PR"
    },
    {
      "tool": "filesystem_mcp",
      "reason": "Cursor Read/Write used instead"
    },
    {
      "tool": "web_search",
      "reason": "AL-03 web_search_needed: false per roadmap"
    },
    {
      "tool": "codex",
      "reason": "not invoked"
    }
  ],
  "web_research": [],
  "changed_files": [
    "scripts/tool_probe.py",
    ".github/workflows/tool-probe.yml",
    ".pre-commit-config.yaml",
    "package.json",
    "docs/TOOL_INVENTORY.md",
    "reports/tool_probe_report.json",
    "reports/gate_result.json",
    "reports/latest-agent-report.json",
    "reports/agent_audit_log.jsonl"
  ],
  "commands_run": [
    "python3 scripts/tool_probe.py",
    "python3 scripts/tool_probe.py --ci",
    "npm run agent:probe:ci",
    "python3 scripts/agent_gate.py"
  ],
  "test_results": [
    "tool_probe --ci: passed (status partial; BLOCKED_ENV docker, java)",
    "agent_gate: passed",
    "npm agent:check: 12 playwright tests passed"
  ],
  "issues_found": [],
  "issues_fixed": [],
  "remaining_issues": [
    "pre-commit requires manual pip install pre-commit && pre-commit install",
    "GitHub Actions workflow not verified on remote until push",
    "pytest not in venv — gate skips with note"
  ],
  "severity_summary": {
    "p0": 0,
    "p1": 0,
    "p2": 0,
    "p3": 1
  },
  "gate_status": "passed",
  "blockers": [],
  "risks": [
    "CI cache path assumes apps/web/package-lock.json exists",
    "Optional BLOCKED_ENV binaries may differ between macOS dev and ubuntu CI"
  ],
  "next_recommended_round": "AL-04 MCP 线程注册表文档化 或 AL-13 user_view_test 增强",
  "human_decisions_required": [
    "Run pre-commit install if local commit hooks desired",
    "Push to verify GitHub Actions tool-probe workflow on remote"
  ]
}
